{
  "$schema": "https://json-schema.org/draft/2020-12/schema",
  "$id": "https://j7an.github.io/cross-agent-reviews/schema/v1/round-settle.json",
  "title": "RoundSettle",
  "type": "object",
  "additionalProperties": false,
  "required": [
    "round", "stage", "schema_version", "slug",
    "artifact_type", "artifact_path", "emitted_at",
    "slice_plan", "adjudication_summary",
    "adjudications", "accepted_findings", "rejected_findings",
    "changelog", "self_review"
  ],
  "properties": {
    "round": {"type": "integer", "enum": [1, 2, 3]},
    "stage": {"type": "string", "enum": ["1b", "2b", "3b"]},
    "schema_version": {"const": 1},
    "slug": {"type": "string", "pattern": "^[A-Za-z0-9._-]+$"},
    "artifact_type": {"type": "string", "enum": ["spec", "plan"]},
    "artifact_path": {"type": "string", "minLength": 1},
    "emitted_at": {"type": "string", "pattern": "^\\d{4}-\\d{2}-\\d{2}T\\d{2}:\\d{2}:\\d{2}Z$"},
    "slice_plan": {
      "type": "array",
      "minItems": 1,
      "items": {
        "type": "object",
        "additionalProperties": false,
        "required": ["agent_id", "concern", "slice_definition", "is_fixed"],
        "properties": {
          "agent_id": {"type": "integer", "minimum": 1, "maximum": 6},
          "concern": {"type": "string"},
          "slice_definition": {"type": "string"},
          "is_fixed": {"type": "boolean"}
        }
      }
    },
    "adjudication_summary": {
      "type": "object",
      "additionalProperties": false,
      "required": ["accepted", "rejected"],
      "properties": {
        "accepted": {"type": "integer", "minimum": 0},
        "rejected": {"type": "integer", "minimum": 0}
      }
    },
    "adjudications": {"type": "array", "items": {"$ref": "https://j7an.github.io/cross-agent-reviews/schema/v1/adjudication.json"}},
    "accepted_findings": {"type": "array", "items": {"$ref": "https://j7an.github.io/cross-agent-reviews/schema/v1/finding.json"}},
    "rejected_findings": {
      "type": "array",
      "items": {
        "type": "object",
        "additionalProperties": false,
        "required": ["id", "location", "severity", "finding", "why_it_matters", "suggested_direction", "rejection_reason"],
        "properties": {
          "id": {"type": "string", "pattern": "^R[123]-[1-6]-[0-9]{3}$"},
          "location": {"type": "string"},
          "severity": {"type": "string", "enum": ["blocker", "gap", "nit", "false_positive_check"]},
          "finding": {"type": "string"},
          "why_it_matters": {"type": "string"},
          "suggested_direction": {"type": "string"},
          "rejection_reason": {"type": "string", "minLength": 1}
        }
      }
    },
    "changelog": {"type": "array", "items": {"$ref": "https://j7an.github.io/cross-agent-reviews/schema/v1/changelog-entry.json"}},
    "self_review": {"type": "array", "items": {"$ref": "https://j7an.github.io/cross-agent-reviews/schema/v1/self-review-entry.json"}},
    "final_status": {"type": "string", "enum": ["READY_FOR_IMPLEMENTATION", "CORRECTED_PENDING_VERIFICATION"]},
    "auto_settled": {
      "type": "object",
      "additionalProperties": false,
      "required": ["trigger", "source_stage", "source_round_hash", "reason"],
      "properties": {
        "trigger": {"const": "clean_audit_zero_findings"},
        "source_stage": {"type": "string", "enum": ["1a", "2a"]},
        "source_round_hash": {"$ref": "#/$defs/content_hash"},
        "reason": {"type": "string", "minLength": 1}
      }
    }
  },
  "allOf": [
    {"if": {"properties": {"stage": {"const": "1b"}}}, "then": {"properties": {"round": {"const": 1}}, "not": {"required": ["final_status"]}}},
    {"if": {"properties": {"stage": {"const": "2b"}}}, "then": {"properties": {"round": {"const": 2}}, "not": {"required": ["final_status"]}}},
    {
      "if": {"properties": {"stage": {"const": "3b"}}},
      "then": {
        "properties": {"round": {"const": 3}},
        "required": ["final_status"],
        "allOf": [
          {
            "if": {"properties": {"accepted_findings": {"maxItems": 0}}},
            "then": {"properties": {"final_status": {"const": "READY_FOR_IMPLEMENTATION"}}},
            "else": {"properties": {"final_status": {"const": "CORRECTED_PENDING_VERIFICATION"}}}
          }
        ]
      }
    },
    {
      "if": {"properties": {"stage": {"const": "3b"}}},
      "then": {
        "properties": {
          "accepted_findings": {"items": {"properties": {"severity": {"const": "blocker"}}}}
        }
      }
    },
    {
      "if": {"properties": {"stage": {"const": "1b"}}, "required": ["stage", "auto_settled"]},
      "then": {"properties": {"auto_settled": {"properties": {"source_stage": {"const": "1a"}}}}}
    },
    {
      "if": {"properties": {"stage": {"const": "2b"}}, "required": ["stage", "auto_settled"]},
      "then": {"properties": {"auto_settled": {"properties": {"source_stage": {"const": "2a"}}}}}
    },
    {
      "if": {"properties": {"stage": {"const": "3b"}}},
      "then": {"not": {"required": ["auto_settled"]}}
    }
  ],
  "$defs": {
    "content_hash": {"type": "string", "pattern": "^sha256:[0-9a-f]{64}$"}
  }
}
